{
  "id": "cbor-envelope-symbol-address-v1",
  "document": {
    "type": "address",
    "chain": "symbol",
    "networkId": 152,
    "generationHashSeed": "57F7DA205008026C776CB6AED843393F04CD458E7D55817A54BEBDD4058A7D54",
    "address": "988E1191A25A88142C2FB3F69787576E3DC713EFC1CE4DE9"
  },
  "payloadCbor": "A167616464726573735818988E1191A25A88142C2FB3F69787576E3DC713EFC1CE4DE9",
  "envelopeCbor": "A86474797065676164647265737365636861696E6673796D626F6C676E6574776F726BA262696418987267656E65726174696F6E4861736853656564582057F7DA205008026C776CB6AED843393F04CD458E7D55817A54BEBDD4058A7D54677061796C6F61645823A167616464726573735818988E1191A25A88142C2FB3F69787576E3DC713EFC1CE4DE96776657273696F6E016870726F746F636F6C64736E69666A656E6372797074696F6EA169616C676F726974686D646E6F6E656B636F6D7072657373696F6E646E6F6E65"
}
